{
  "invoice_id": "INV-1042",
  "created_at": "2026-10-22T09:03:20Z",
  "vendor_claimed": "Acme Supply Billing",
  "vendor_id": "ven_acme_supply",
  "payee_name": "Acme Supply Co.",
  "amount": 4820.0,
  "currency": "USD",
  "bank_account_new": "****8841",
  "bank_account_on_file": "****1234",
  "sender_email": "billing@acmesupply-billing.com",
  "sender_domain": "acmesupply-billing.com",
  "signals": [
    {
      "name": "bank_account_changed",
      "fired": true,
      "weight": "highest",
      "detail": "Requests payment to ****8841; account on file is ****1234; Routing ****9593; routing on file is ****0358",
      "evidence": {
        "new_last4": "8841",
        "on_file_last4": "1234",
        "new_routing": "9593",
        "on_file_routing": "0358",
        "claimed_change": true
      }
    },
    {
      "name": "prompt_injection",
      "fired": false,
      "weight": "highest",
      "detail": "No hidden or AI-addressed text",
      "evidence": {
        "count": 0
      }
    },
    {
      "name": "vendor_contact_changed",
      "fired": false,
      "weight": "high",
      "detail": "No vendor record edits in the last 90 days",
      "evidence": {
        "days_ago": null,
        "field": null,
        "requested": false
      }
    },
    {
      "name": "payee_name_mismatch",
      "fired": false,
      "weight": "high",
      "detail": "Payee matches vendor on file",
      "evidence": {
        "payee": "Acme Supply Co.",
        "similarity": 1.0
      }
    },
    {
      "name": "lookalike_domain",
      "fired": true,
      "weight": "high",
      "detail": "acmesupply-billing.com (sender) imitates acmesupply.com, the vendor domain on file, by label-append",
      "evidence": {
        "field": "sender",
        "domain": "acmesupply-billing.com",
        "sender_domain": "acmesupply-billing.com",
        "on_file_domain": "acmesupply.com",
        "method": "label-append",
        "differs": true
      }
    },
    {
      "name": "new_domain_certificate",
      "fired": true,
      "weight": "medium-high",
      "detail": "First certificate for acmesupply-billing.com seen 2026-10-20 02:14 UTC, 2 days before the invoice",
      "evidence": {
        "status": "ok",
        "domain": "acmesupply-billing.com",
        "none_found": false,
        "first_seen": "2026-10-20T02:14:00Z",
        "age_days": 2,
        "count": 1
      }
    },
    {
      "name": "amount_anomaly",
      "fired": false,
      "weight": "medium",
      "detail": "$4,820.00 is within this vendor's usual range (median $4,650.00)",
      "evidence": {
        "n": 5,
        "median": 4650.0,
        "max": 4900.0,
        "ratio": 1.04
      }
    },
    {
      "name": "urgency_language",
      "fired": true,
      "weight": "low-medium",
      "detail": "\"before friday's\", \"effective immediately\"",
      "evidence": {
        "phrases": [
          "before friday's",
          "effective immediately"
        ]
      }
    },
    {
      "name": "new_vendor",
      "fired": false,
      "weight": "gate",
      "detail": "Vendor on file since 2021"
    },
    {
      "name": "llm_judgment",
      "fired": false,
      "weight": "residual",
      "detail": "skipped: offline mode (DORIS_OFFLINE=1)",
      "evidence": {
        "status": "skipped",
        "reason": "offline mode (DORIS_OFFLINE=1)"
      }
    }
  ],
  "risk_score": 0.79,
  "decision": "CALLBACK",
  "reasons": [
    "Bank account change requested: ****1234 to ****8841",
    "Sender domain acmesupply-billing.com is a lookalike of acmesupply.com (label-append)",
    "That domain got its first certificate 2 days ago",
    "Pressure language: \"before friday's\", \"effective immediately\"",
    "Doris is calling +1 415 555 0123, on file since March 2021"
  ],
  "callback_number": "+14155550123",
  "callback_number_on_file_since": "2021-03-10T17:22:00Z",
  "ct_timeline": [
    {
      "domain": "acmesupply.com",
      "kind": "cert_first_seen",
      "at": "2016-05-02T14:31:00Z",
      "label": "acmesupply.com first certificate"
    },
    {
      "domain": "acmesupply.com",
      "kind": "cert_issued",
      "at": "2019-05-01T10:00:00Z",
      "label": "acmesupply.com certificate issued"
    },
    {
      "domain": "acmesupply.com",
      "kind": "vendor_on_file_since",
      "at": "2021-03-10T17:22:00Z",
      "label": "Acme Supply Co. phone on file since"
    },
    {
      "domain": "acmesupply.com",
      "kind": "cert_issued",
      "at": "2022-04-30T09:12:00Z",
      "label": "acmesupply.com certificate issued"
    },
    {
      "domain": "acmesupply.com",
      "kind": "cert_issued",
      "at": "2025-04-29T08:40:00Z",
      "label": "acmesupply.com certificate issued"
    },
    {
      "domain": "acmesupply-billing.com",
      "kind": "cert_first_seen",
      "at": "2026-10-20T02:14:00Z",
      "label": "acmesupply-billing.com first certificate"
    },
    {
      "domain": "acmesupply-billing.com",
      "kind": "invoice_received",
      "at": "2026-10-22T09:03:00Z",
      "label": "Invoice INV-1042 received"
    }
  ],
  "llm_rationale": null,
  "supersedes": null,
  "decision_id": "dec_51db47159142",
  "seq": 7,
  "prev_hash": "sha256:798d69b262956e491e8fe17ce8ea448b20db29e9c816ba784ba3a0174a67570b",
  "audit_hash": "sha256:2c0152c0f4125447491a803bde50d01a526d93fb6c6004c0866aaabe0dae069c"
}
