{
  "invoice_id": "INV-1041",
  "created_at": "2026-10-22T09:03:20Z",
  "vendor_claimed": "Acme Supply",
  "vendor_id": "ven_acme_supply",
  "payee_name": "Acme Supply Co.",
  "amount": 4820.0,
  "currency": "USD",
  "bank_account_new": null,
  "bank_account_on_file": "****1234",
  "sender_email": "billing@acmesupply.com",
  "sender_domain": "acmesupply.com",
  "signals": [
    {
      "name": "bank_account_changed",
      "fired": false,
      "weight": "highest",
      "detail": "Account on file ****1234 unchanged",
      "evidence": {
        "new_last4": "1234",
        "on_file_last4": "1234",
        "new_routing": "0358",
        "on_file_routing": "0358",
        "claimed_change": false,
        "other_accounts": []
      }
    },
    {
      "name": "prompt_injection",
      "fired": false,
      "weight": "highest",
      "detail": "No hidden or AI-addressed text",
      "evidence": {
        "count": 0
      }
    },
    {
      "name": "vendor_contact_changed",
      "fired": false,
      "weight": "high",
      "detail": "No vendor record edits in the last 90 days",
      "evidence": {
        "days_ago": null,
        "field": null,
        "requested": false
      }
    },
    {
      "name": "payee_name_mismatch",
      "fired": false,
      "weight": "high",
      "detail": "Payee matches vendor on file",
      "evidence": {
        "payee": "Acme Supply Co.",
        "similarity": 1.0
      }
    },
    {
      "name": "lookalike_domain",
      "fired": false,
      "weight": "high",
      "detail": "Sender domain is the vendor domain on file",
      "evidence": {
        "field": "sender",
        "domain": "acmesupply.com",
        "sender_domain": "acmesupply.com",
        "on_file_domain": "acmesupply.com",
        "method": null,
        "differs": false
      }
    },
    {
      "name": "new_domain_certificate",
      "fired": false,
      "weight": "medium-high",
      "detail": "First certificate seen 2016-05-02",
      "evidence": {
        "status": "ok",
        "domain": "acmesupply.com",
        "none_found": false,
        "first_seen": "2016-05-02T14:31:00Z",
        "age_days": 3824,
        "count": 4
      }
    },
    {
      "name": "amount_anomaly",
      "fired": false,
      "weight": "medium",
      "detail": "$4,820.00 is within this vendor's usual range (median $4,650.00)",
      "evidence": {
        "n": 5,
        "median": 4650.0,
        "max": 4900.0,
        "ratio": 1.04
      }
    },
    {
      "name": "urgency_language",
      "fired": false,
      "weight": "low-medium",
      "detail": "No pressure language",
      "evidence": {
        "phrases": []
      }
    },
    {
      "name": "new_vendor",
      "fired": false,
      "weight": "gate",
      "detail": "On file since 2021"
    },
    {
      "name": "llm_judgment",
      "fired": false,
      "weight": "residual",
      "detail": "skipped: offline mode (DORIS_OFFLINE=1)",
      "evidence": {
        "status": "skipped",
        "reason": "offline mode (DORIS_OFFLINE=1)"
      }
    }
  ],
  "risk_score": 0.0,
  "decision": "PAY",
  "reasons": [
    "Routine invoice from a vendor on file",
    "Bank account unchanged (****1234)",
    "Amount within normal range"
  ],
  "callback_number": "+14155550123",
  "callback_number_on_file_since": "2021-03-10T17:22:00Z",
  "ct_timeline": [
    {
      "domain": "acmesupply.com",
      "kind": "cert_first_seen",
      "at": "2016-05-02T14:31:00Z",
      "label": "acmesupply.com first certificate"
    },
    {
      "domain": "acmesupply.com",
      "kind": "cert_issued",
      "at": "2019-05-01T10:00:00Z",
      "label": "acmesupply.com certificate issued"
    },
    {
      "domain": "acmesupply.com",
      "kind": "vendor_on_file_since",
      "at": "2021-03-10T17:22:00Z",
      "label": "Acme Supply Co. phone on file since"
    },
    {
      "domain": "acmesupply.com",
      "kind": "cert_issued",
      "at": "2022-04-30T09:12:00Z",
      "label": "acmesupply.com certificate issued"
    },
    {
      "domain": "acmesupply.com",
      "kind": "cert_issued",
      "at": "2025-04-29T08:40:00Z",
      "label": "acmesupply.com certificate issued"
    },
    {
      "domain": "acmesupply.com",
      "kind": "invoice_received",
      "at": "2026-10-22T08:41:00Z",
      "label": "Invoice INV-1041 received"
    }
  ],
  "llm_rationale": null,
  "supersedes": null,
  "decision_id": "dec_ffb70ef54f95",
  "seq": 5,
  "prev_hash": "sha256:2da6ef64353dd758c4f7dcc8189447f4a562dac01e9825a4799166d33a65ff9b",
  "audit_hash": "sha256:96ad16afb83d856d96c5d40a4f5e6031c30fec219f25e2ed2a1daf2ca7ea19c1"
}
