{
  "invoice_id": "INV-1046",
  "created_at": "2026-10-22T09:03:20Z",
  "vendor_claimed": "Acme Supply Accounts",
  "vendor_id": "ven_acme_supply",
  "payee_name": "Acme Supply Co",
  "amount": 12400.0,
  "currency": "USD",
  "bank_account_new": "****9930",
  "bank_account_on_file": "****1234",
  "sender_email": "accounts@acme-supply.co",
  "sender_domain": "acme-supply.co",
  "signals": [
    {
      "name": "bank_account_changed",
      "fired": true,
      "weight": "highest",
      "detail": "Requests payment to ****9930; account on file is ****1234; Routing ****1627; routing on file is ****0358",
      "evidence": {
        "new_last4": "9930",
        "on_file_last4": "1234",
        "new_routing": "1627",
        "on_file_routing": "0358",
        "claimed_change": true,
        "other_accounts": []
      }
    },
    {
      "name": "prompt_injection",
      "fired": false,
      "weight": "highest",
      "detail": "No hidden or AI-addressed text",
      "evidence": {
        "count": 0
      }
    },
    {
      "name": "vendor_contact_changed",
      "fired": false,
      "weight": "high",
      "detail": "No vendor record edits in the last 90 days",
      "evidence": {
        "days_ago": null,
        "field": null,
        "requested": false
      }
    },
    {
      "name": "payee_name_mismatch",
      "fired": false,
      "weight": "high",
      "detail": "Payee matches vendor on file",
      "evidence": {
        "payee": "Acme Supply Co",
        "similarity": 1.0
      }
    },
    {
      "name": "lookalike_domain",
      "fired": true,
      "weight": "high",
      "detail": "acme-supply.co (sender) imitates acmesupply.com, the vendor domain on file, by edit-distance",
      "evidence": {
        "field": "sender",
        "domain": "acme-supply.co",
        "sender_domain": "acme-supply.co",
        "on_file_domain": "acmesupply.com",
        "method": "edit-distance",
        "differs": true
      }
    },
    {
      "name": "new_domain_certificate",
      "fired": true,
      "weight": "medium-high",
      "detail": "First certificate for acme-supply.co seen 2026-10-19 23:40 UTC, 2 days before the invoice",
      "evidence": {
        "status": "ok",
        "domain": "acme-supply.co",
        "none_found": false,
        "first_seen": "2026-10-19T23:40:00Z",
        "age_days": 2,
        "count": 1
      }
    },
    {
      "name": "amount_anomaly",
      "fired": true,
      "weight": "medium",
      "detail": "$12,400.00 is 2.67x this vendor's median payment ($4,650.00; max $4,900.00)",
      "evidence": {
        "n": 5,
        "median": 4650.0,
        "max": 4900.0,
        "ratio": 2.67
      }
    },
    {
      "name": "urgency_language",
      "fired": true,
      "weight": "low-medium",
      "detail": "\"urgent\", \"today\", \"avoid service interruption\"",
      "evidence": {
        "phrases": [
          "urgent",
          "today",
          "avoid service interruption"
        ]
      }
    },
    {
      "name": "new_vendor",
      "fired": false,
      "weight": "gate",
      "detail": "On file since 2021"
    },
    {
      "name": "llm_judgment",
      "fired": false,
      "weight": "residual",
      "detail": "skipped: offline mode (DORIS_OFFLINE=1)",
      "evidence": {
        "status": "skipped",
        "reason": "offline mode (DORIS_OFFLINE=1)"
      }
    }
  ],
  "risk_score": 0.81,
  "decision": "CALLBACK",
  "reasons": [
    "Bank account change requested: ****1234 to ****9930",
    "Sender domain acme-supply.co is a lookalike of acmesupply.com (edit-distance)",
    "That domain got its first certificate 2 days ago",
    "Amount out of line with history: $12,400.00 is 2.67x this vendor's median payment ($4,650.00; max $4,900.00)",
    "Pressure language: \"urgent\", \"today\", \"avoid service interruption\"",
    "Doris is calling +1 415 555 0123, on file since March 2021"
  ],
  "callback_number": "+14155550123",
  "callback_number_on_file_since": "2021-03-10T17:22:00Z",
  "ct_timeline": [
    {
      "domain": "acmesupply.com",
      "kind": "cert_first_seen",
      "at": "2016-05-02T14:31:00Z",
      "label": "acmesupply.com first certificate"
    },
    {
      "domain": "acmesupply.com",
      "kind": "cert_issued",
      "at": "2019-05-01T10:00:00Z",
      "label": "acmesupply.com certificate issued"
    },
    {
      "domain": "acmesupply.com",
      "kind": "vendor_on_file_since",
      "at": "2021-03-10T17:22:00Z",
      "label": "Acme Supply Co. phone on file since"
    },
    {
      "domain": "acmesupply.com",
      "kind": "cert_issued",
      "at": "2022-04-30T09:12:00Z",
      "label": "acmesupply.com certificate issued"
    },
    {
      "domain": "acmesupply.com",
      "kind": "cert_issued",
      "at": "2025-04-29T08:40:00Z",
      "label": "acmesupply.com certificate issued"
    },
    {
      "domain": "acme-supply.co",
      "kind": "cert_first_seen",
      "at": "2026-10-19T23:40:00Z",
      "label": "acme-supply.co first certificate"
    },
    {
      "domain": "acme-supply.co",
      "kind": "invoice_received",
      "at": "2026-10-22T15:12:00Z",
      "label": "Invoice INV-1046 received"
    }
  ],
  "llm_rationale": null,
  "supersedes": null,
  "decision_id": "dec_71a0d04c9054",
  "seq": 13,
  "prev_hash": "sha256:fb45d8781ea47da57873c2afc54a2ccc48450a6a5eba47bb05a20f70deb1e12d",
  "audit_hash": "sha256:cd4d78e8fe30b780fe3c0c0b5ef8cf0fac918b9e9fc9e7a9d5e1685cc99a0b2d"
}
